{
  "skill": "web3/web3-consensus",
  "version": 1,
  "generatedFrom": "frontmatter",
  "frontmatterHash": "d5e4365784112be044f04285dd34def52f28c7be11778cb5d9c16434c59e54e9",
  "role": "workflow",
  "router": {
    "positive": [],
    "negative": [],
    "requiredSignals": []
  },
  "execution": {
    "defaultAgent": "explore",
    "isolation": "none",
    "maxTurns": 6,
    "modelTier": "reasoning",
    "tools": {
      "allow": [
        "Read",
        "Grep",
        "Glob",
        "WebFetch",
        "WebSearch"
      ],
      "deny": []
    }
  },
  "guardrails": {
    "sideEffects": [],
    "approvalRequired": false,
    "approvalFor": [],
    "risk": "low",
    "trustTier": 1
  },
  "verification": {
    "commands": [],
    "artifactSchema": null
  },
  "observability": {
    "traceEvents": [
      "skill.route",
      "skill.execute",
      "skill.verify"
    ]
  }
}
