{
  "skill": "data/feature-store",
  "version": 1,
  "generatedFrom": "frontmatter",
  "frontmatterHash": "66571703d48eb9c70e5bd8cff092d6320f0ae5296d9374445338db0fb7756b14",
  "role": "workflow",
  "router": {
    "positive": [],
    "negative": [],
    "requiredSignals": []
  },
  "execution": {
    "defaultAgent": "general",
    "isolation": "none",
    "maxTurns": 6,
    "modelTier": "reasoning",
    "tools": {
      "allow": [
        "Read",
        "Grep",
        "Glob"
      ],
      "deny": []
    }
  },
  "guardrails": {
    "sideEffects": [],
    "approvalRequired": true,
    "approvalFor": [],
    "risk": "medium",
    "trustTier": 3
  },
  "verification": {
    "commands": [],
    "artifactSchema": null
  },
  "observability": {
    "traceEvents": [
      "skill.route",
      "skill.execute",
      "skill.verify"
    ]
  }
}
