{
  "skill": "delivery/implement",
  "version": 1,
  "generatedFrom": "frontmatter",
  "frontmatterHash": "df727a2fb4500c94028eb9a2aa16259b8fefdbf7568d3e6c9111546ef9adf0b8",
  "role": "workflow",
  "router": {
    "positive": [],
    "negative": [],
    "requiredSignals": []
  },
  "execution": {
    "defaultAgent": "general",
    "isolation": "worktree",
    "maxTurns": 6,
    "modelTier": "reasoning",
    "tools": {
      "allow": [
        "Read",
        "Grep",
        "Glob",
        "Edit",
        "Write"
      ],
      "deny": []
    }
  },
  "guardrails": {
    "sideEffects": [
      "write-code",
      "commit-git",
      "push-branch"
    ],
    "approvalRequired": true,
    "approvalFor": [
      "write-code",
      "commit-git",
      "push-branch"
    ],
    "risk": "medium",
    "trustTier": 3
  },
  "verification": {
    "commands": [
      "node .agents/skills/platform/check-all.mjs"
    ],
    "artifactSchema": null
  },
  "observability": {
    "traceEvents": [
      "skill.route",
      "skill.execute",
      "skill.verify"
    ]
  }
}
