{
  "skill": "delivery/testing",
  "version": 1,
  "generatedFrom": "frontmatter",
  "frontmatterHash": "a3ae14f9360ae1c4a94ba510e86a216f3481f7a773f03869dc821af347c9b481",
  "role": "workflow",
  "router": {
    "positive": [],
    "negative": [],
    "requiredSignals": []
  },
  "execution": {
    "defaultAgent": "explore",
    "isolation": "none",
    "maxTurns": 6,
    "modelTier": "reasoning",
    "tools": {
      "allow": [
        "Read",
        "Grep",
        "Glob"
      ],
      "deny": []
    }
  },
  "guardrails": {
    "sideEffects": [],
    "approvalRequired": false,
    "approvalFor": [],
    "risk": "low",
    "trustTier": 1
  },
  "verification": {
    "commands": [
      "node .agents/skills/platform/check-all.mjs"
    ],
    "artifactSchema": null
  },
  "observability": {
    "traceEvents": [
      "skill.route",
      "skill.execute",
      "skill.verify"
    ]
  }
}
