{
  "skill": "routing/work-item-router",
  "version": 1,
  "generatedFrom": "frontmatter",
  "frontmatterHash": "6211adf850b792fbc13699b5eb9f5a0c4548562a0ddb540860b6f5d064a81cb1",
  "role": "workflow",
  "router": {
    "positive": [],
    "negative": [],
    "requiredSignals": []
  },
  "execution": {
    "defaultAgent": "explore",
    "isolation": "none",
    "maxTurns": 6,
    "modelTier": "router",
    "tools": {
      "allow": [
        "Read",
        "Grep",
        "Glob"
      ],
      "deny": []
    }
  },
  "guardrails": {
    "sideEffects": [],
    "approvalRequired": false,
    "approvalFor": [],
    "risk": "low",
    "trustTier": 1
  },
  "verification": {
    "commands": [],
    "artifactSchema": null
  },
  "observability": {
    "traceEvents": [
      "skill.route",
      "skill.execute",
      "skill.verify"
    ]
  }
}
