{
  "skill": "quant/quant-factors",
  "version": 1,
  "generatedFrom": "frontmatter",
  "frontmatterHash": "d41b5bf60c5c39dfb6a95bd23a9a7e65e0325888b0de5c9d17953fd48119dbb9",
  "role": "workflow",
  "router": {
    "positive": [],
    "negative": [],
    "requiredSignals": []
  },
  "execution": {
    "defaultAgent": "explore",
    "isolation": "none",
    "maxTurns": 6,
    "modelTier": "reasoning",
    "tools": {
      "allow": [
        "Read",
        "Grep",
        "Glob"
      ],
      "deny": []
    }
  },
  "guardrails": {
    "sideEffects": [],
    "approvalRequired": false,
    "approvalFor": [],
    "risk": "low",
    "trustTier": 1
  },
  "verification": {
    "commands": [],
    "artifactSchema": null
  },
  "observability": {
    "traceEvents": [
      "skill.route",
      "skill.execute",
      "skill.verify"
    ]
  }
}
