{
  "skill": "sec/incident-forensics",
  "version": 1,
  "generatedFrom": "frontmatter",
  "frontmatterHash": "c1e659caa09545de6ecd68c3125db76476b42ef8e9eb301ee4e1120b27b4d1b8",
  "role": "workflow",
  "router": {
    "positive": [],
    "negative": [],
    "requiredSignals": []
  },
  "execution": {
    "defaultAgent": "general",
    "isolation": "none",
    "maxTurns": 6,
    "modelTier": "reasoning",
    "tools": {
      "allow": [
        "Read",
        "Grep",
        "Glob",
        "WebFetch",
        "WebSearch"
      ],
      "deny": []
    }
  },
  "guardrails": {
    "sideEffects": [],
    "approvalRequired": true,
    "approvalFor": [],
    "risk": "medium",
    "trustTier": 3
  },
  "verification": {
    "commands": [],
    "artifactSchema": null
  },
  "observability": {
    "traceEvents": [
      "skill.route",
      "skill.execute",
      "skill.verify"
    ]
  }
}
