{
  "skill": "routing/grilling",
  "version": 1,
  "generatedFrom": "frontmatter",
  "frontmatterHash": "38cffcec507dadf5219cdea70c6f3fcb4475543c0586959f718d27302980a2bc",
  "role": "workflow",
  "router": {
    "positive": [],
    "negative": [],
    "requiredSignals": []
  },
  "execution": {
    "defaultAgent": "explore",
    "isolation": "none",
    "maxTurns": 6,
    "modelTier": "router",
    "tools": {
      "allow": [
        "Read",
        "Grep",
        "Glob"
      ],
      "deny": []
    }
  },
  "guardrails": {
    "sideEffects": [],
    "approvalRequired": false,
    "approvalFor": [],
    "risk": "low",
    "trustTier": 1
  },
  "verification": {
    "commands": [],
    "artifactSchema": null
  },
  "observability": {
    "traceEvents": [
      "skill.route",
      "skill.execute",
      "skill.verify"
    ]
  }
}
