{
  "skill": "skill-dev/skill-testing-framework",
  "version": 1,
  "generatedFrom": "frontmatter",
  "frontmatterHash": "9d5ef550609932e8177de392bd34be39f05ecbdf8366d5b362efbc3871e1cc35",
  "role": "workflow",
  "router": {
    "positive": [],
    "negative": [],
    "requiredSignals": []
  },
  "execution": {
    "defaultAgent": "general",
    "isolation": "worktree",
    "maxTurns": 6,
    "modelTier": "reasoning",
    "tools": {
      "allow": [
        "Read",
        "Grep",
        "Glob",
        "Edit",
        "Write"
      ],
      "deny": []
    }
  },
  "guardrails": {
    "sideEffects": [
      "write-files"
    ],
    "approvalRequired": false,
    "approvalFor": [],
    "risk": "low",
    "trustTier": 1
  },
  "verification": {
    "commands": [
      "node .agents/skills/platform/check-all.mjs"
    ],
    "artifactSchema": null
  },
  "observability": {
    "traceEvents": [
      "skill.route",
      "skill.execute",
      "skill.verify"
    ]
  }
}
