{
  "skill": "foundation/skill-composition",
  "version": 1,
  "generatedFrom": "frontmatter",
  "frontmatterHash": "e3e336279ed43e3700f97058eecb8f4e7c2eb552da982394b07bf776de4b4678",
  "role": "workflow",
  "router": {
    "positive": [],
    "negative": [],
    "requiredSignals": []
  },
  "execution": {
    "defaultAgent": "general",
    "isolation": "none",
    "maxTurns": 10,
    "modelTier": "reasoning",
    "tools": {
      "allow": [
        "Read",
        "Grep",
        "Glob"
      ],
      "deny": []
    }
  },
  "guardrails": {
    "sideEffects": [
      "orchestration"
    ],
    "approvalRequired": false,
    "approvalFor": [],
    "risk": "medium",
    "trustTier": 3
  },
  "verification": {
    "commands": [],
    "artifactSchema": null
  },
  "observability": {
    "traceEvents": [
      "skill.route",
      "skill.execute",
      "skill.verify"
    ]
  }
}
