{
  "skill": "devops/devops-ci-cd-pipeline",
  "version": 1,
  "generatedFrom": "frontmatter",
  "frontmatterHash": "c1613011e530cd9cfdd1cace45c1a3a6e65efb2704e642ce3a90c1aca8e29f0e",
  "role": "workflow",
  "router": {
    "positive": [],
    "negative": [],
    "requiredSignals": []
  },
  "execution": {
    "defaultAgent": "general",
    "isolation": "none",
    "maxTurns": 5,
    "modelTier": "reasoning",
    "tools": {
      "allow": [
        "Read",
        "Grep",
        "Glob"
      ],
      "deny": []
    }
  },
  "guardrails": {
    "sideEffects": [],
    "approvalRequired": true,
    "approvalFor": [],
    "risk": "medium",
    "trustTier": 3
  },
  "verification": {
    "commands": [],
    "artifactSchema": null
  },
  "observability": {
    "traceEvents": [
      "skill.route",
      "skill.execute",
      "skill.verify"
    ]
  }
}
